Titulo;Objeto
LEY DE REFORMA CONSTITUCIONAL QUE RECONOCE COMO SUJETOS DE DERECHO A LOS RÍOS AMAZÓNICOS, ESTABLECE UN SISTEMA ESPECIAL DE PROTECCIÓ Y CONSERVACIÓN INTEGRAL POR SUS ESPECIALES CONDICIONES;Propone reconocer a los ríos de la Amazonía como sujeto y titulares de derecho debido al valor intrínseco que tienen y la importancia que detenta con respecto al medio ambiente y ecosistemas del Perú, a fin de garantizar su protección especial.
"LEY QUE MODIFICA EL ARTICULO 75 DE LA LEY N° 29338, LEY DE RECURSOS HÍDRICOS Y QUE DECLARA COMO """"ZONA DE RESERVA INTANGIBLE Y DE CONSERVACIÓN INTEGRAL LA PROTECCIÓN DE LAS CABECERAS DE CUENCAS HIDROGRÁFICAS""""";"Propone declarar """"Zona reserva intangible y de conservación integral, protección y promoción a las cabeceras de cuencas hidrográficas."
LEY QUE DECLARA DE INTERÉS NACIONAL Y NECESIDAD PÚBLICA LA CONSTRUCCIÓN E IMPLEMENTACIÓN DE UN HOSPITAL CON CATEGORÍA III-1 EN LA PROVINCIA DE HUAYTARA EN EL DEPARTAMENTO DE HUANCAVELICA;Propone declarar de necesidad pública e interés nacional la construcción e implementación de un hospital con categoría III - 1 en la ciudad de Huaytará en la provincia de Huaytará en el departamento de Huancavelica, para garantizar la adecuada atención del servicio de salud pública, bajo criterios de seguridad, oportunidad y calidad
LEY QUE PROPONE SE DECLARE DE INTERÉS NACIONAL Y PREFERENTE NECESIDAD PÚBLICO LA REORGANIZACIÓN GEOGRÁFICA - TERRITORIAL URBANA DE LA PROVINCIA DE SAN ROMÁN EN EL DEPARTAMENTO DE PUNO;Propone declarar de interés nacional y preferente necesidad pública la reorganización geográfica - territorial urbana de la provincia de San Román en el departamento de Puno, a fin de lograr un adecuado desarrollo urbano con la creación de distritos adicionales al distrito San Miguel, acorde a su distribución especial y crecimiento poblacional.
LEY QUE MODIFICA EL ARTÍCULO 6 DE LA LEY 31041 LEY DE URGENCIA MÉDICA PARA LA DETERCCIÓN OPORTUNA Y ATENCIÓN INTEGRAL DEL CÁNCER DEL NIÑO Y ADOLESCENTES;Propone modificar el artículo 6 de la Ley 31041 Ley de Urgencia Médica para la detención oportuna y atención integral del cáncer del niño y del adolescente.
LEY QUE PROPONE SE DECLARE DE INTERÉS NACIONAL Y PREFERENTE NECESIDAD PÚBLICA LA CREACIÓN DE LA AUTORIDAD AUTÓNOMA PARA LA DESCONTAMINACIÓN Y EL DESARROLLO INTEGRAL DE LA CUENCA LLALLIMAYO EN EL DEPARTAMENTO DE PUNO;propone declarar de interés y preferente necesidad pública la creación de la autoridad autónoma para la descontaminación y el desarrollo integral de la cuenca Llallimayo en el departamento de Puno.
LEY QUE BRINDA ATRIBUCIONES A LAS ASOCIACIONES DE PADRES DE FAMILIA Y COMITÉS DE AULA PARA LA PREVENCIÓN Y SEGUIMIENTO DE CASOS DE VIOLENCIA Y ACOSO ESCOLAR;"Propone brindar atribuciones a las asociaciones de padres de familia para prevenir y hacer seguimiento de los casos de acoso y violencia escolar, a fin de que, los estudiantes de las diferentes instituciones educativas públicas y privadas de educación básica regular y especial; Educación Técnica Productiva y Básica Alternativa, Puedan gozar de un desarrollo integral y armoniosos libres de acoso y violencia escolar."
LEY QUE PLANTEA DE INTERÉS NACIONAL LA REPATRIACIÓN DE LOS RESTOS FAMILIARES DE JOSÉ GABRIEL CONDORCANQUI NOGUERA, TÚPAC AMARU;Declárese de interés nacional y necesidad pública la repatriación de los restos de Fernando Túpac Amaru y de Juan Bautista Túpac Amaru, la construcción de un Mausoleo para honrar sus restos, así como la implementación de una comisión que realice el estudio histórico y la investigación científica del destino de la familia de José Gabriel Túpac Amaru, la que fuera perseguida, sacrificada y/o expatriada como consecuencia del levantamiento de José Gabriel Condorcanqui Noguera llamado igualmente José Gabriel Túpac Amaru, conocido posteriormente como Túpac Amaru II o simplemente Túpac Amaru y sus esposa Micaela Bastidas Puyuccahua.
LEY QUE DEROGA EL DECRETO LEGISLATIVO 1260, LEY QUE FORTALECE EL CUERPO GENERAL DE BOMBEROS VOLUNTARIOS DEL PERÚ COMO PARTE DEL SISTEMA NACIONAL DE SEGURIDAD CIUDADANA Y REGUILA LA INTENDENCIA NACIONAL DE BOMBEROS DEL PERÚ;La presente norma tiene por objeto restituir la autonomía y personería jurídica del Cuerpo General de Bomberos Voluntarios del Perú, como la autoridad competente en materia de prevención, control y extinción de incendios, está conformado por los bomberos voluntarios en actividad, los bomberos asimilados y los bomberos en situación de retiro, que prestan servicio público de manera voluntaria y ad honorem.
LEY QUE EXCLUYE A LOS TRABAJADORES JURISDICCIONALES Y ADMINISTRATIVOS DEL RÉGIMEN DEL SERVICIO CIVIL;La presente ley tiene por objeto que los trabajadores jurisdiccionales y administrativos del Poder Judicial, con exclusión de los jueces, deben regirse por el régimen laboral de la actividad privada y están exentos de los alcances de la Ley 30057, Ley del Servicio Civil.
LEY QUE MODIFICA LA VIGÉSIMA CUARTA DISPOSICIÓN COMPLEMENTARIA, TRANSITORIA Y FINAL DE LA LEY 29944, LEY DE REFORMA MAGISTERIAL.;"La presente Ley tiene por objeto modificar la Vigésima Cuarta Disposición Complementaria, Transitoria y Final de la Ley 29944, Ley de Reforma Magisterial; a fin de que se suspenda la implementación de la evaluación de desempeño docente."
LEY QUE MODIFICA LOS ARTÍCULOS 06, 20, 21, 22, 25, 68Y 69 DE LA LEY Nº 28036, LEY DE PROMOCIÓN Y DESARROLLO DEL DEPORTE PARA OTORGAR BECAS DE POSGRADO A DEPORTISTAS CALIFICADOS DE ALTO NIVEL PARA DIRIGENCIA SOSTENIBLE DEL SISTEMA INTEGRAL DEPORTIVO NACIONAL;La presente Ley tiene por objeto modificar los artículos 06, 20, 21, 22, 25, 68 y 69 de la Ley Nº 28036, Ley de promoción y Desarrollo del Deporte a fin de otorgar becas de posgrado a deportistas calificados y calificados de alto nivel asegurando la dirigencia sostenible del sistema integral deportivo nacional.
LEY QUE COMPLEMENTA LOS ALCANCES DE LA LEY 28099 Y SUS MODIFICATORIAS, FACULTANDO LA VENTA DIRECTA A FAVOR DE TERCEROS CON FINES DE DESARROLLO URBANO DE PREDIOS PROPIEDAD DE LA MUNICIPALIDAD DISTRITAL DE MAJES PROVINCIA DE CAYLLOMA DEPARTAMENTO DE AREQUIPA DENTRO DE PROGRAMAS MUNICIPALES DE VIVIENDA Y/O DE FORMALIZACIÓN DE ASENTAMIENTOS HUMANOS APROBADOS POR EL GOBIERNO LOCAL DE MAJES-AREQUIPA;Propone facultar a la Municipalidad distrital de Majes, la venta directa de los predios de dominio privado de su propiedad que le fueron transferidos mediante la Ley 28099-modificada por las leyes 28466 y 28630, sólo con fines de desarrollo urbano a favor de terceros y dentro de los alcances de los Programas Municipales de Vivienda y/o Programas de Formalización de Asentamientos Humanos, predios destinados a viviendas tipo huerta, conforme lo faculta la Ley Orgánica de Municipalidades.
LEY QUE MODIFICA EL DECRETO LEGISLATIVO N° 1153 E INCORPORA AL ARTICULO 8° LA DENOMINACION BONIFICACIÓN POR PUESTO ESPECIALIZADO O DE DEDICACIÓN EXCLUSIVA EN SERVICIOS DE SALUD PÚBLICA POR EL APOYO DEL PERSONAL TÉCNICO Y AUXILIAR ASISTENCIAL DE SALUD;Propone incorporar el literal f) en el numeral 8.2 del artículo 8 del Decreto Legislativo 1153. Decreto que regula la política integral de compensaciones y entregas económicas de personal de la salud al servicio del Estado, referido a la bonificación en el puesto de salud pública por las labores de apoyo del personal técnico o auxiliar asistencial de salud.
LEY QUE MOFICICA EL ARTICULO 12 E INCORPORA EL TÍTULO VII DE EDUCACIÓN, EVALUACIÓN Y BENEFICIOS EN LA LEY 29108, LEY DE ASCENSOS DE OFICIALES DE LAS FUERZAS ARMADAS;"Propone modificar el artículo  12 e incorporar el Título VII, referido a Educación, Evaluación y Beneficios en la Ley 29108, Ley de ascensos de Oficiales de las Fuerzas Armadas, con la finalidad de mejorar la formación de los oficiales de las fuerzas armadas; promoviendo el aprendizaje de nuevos conocimientos especializados, competencias y capacidades como condiciones de calificación en su hoja de vida con mira al proceso de ascenso; garantizándose una línea de carrera profesional que permita seleccionar y promover a los oficiales más idóneos, sobre la base del mérito, competencia, imparcialidad y transparencia, en estricto cumplimiento al Principio de Igualda"
LEY QUE ESTABLECE LA DENOMINACIÓN ADECUADA DE LOS PROFESIONALES DE LA SALUD QUE BRINDAN ATENCIÓN A LA MUJER EN SALUD REPRODUCTIVA Y PROHIBE LA INDEBIDA UTILIZACIÓN DE TÉRMINOS QUE SE PRESTAN A CONFUSIÓN Y PONER EN RIESGO LA SALUD;"Propone garantizar los derechos a la salud y a la vida de la mujer y de los usuarios al establecer la adecuada denominación de los profesionales de la salud que atienden la salud reproductiva de la mujer, en concordancia con su formación y competencia profesional; y evitar la intrusión en la profesión del médico cirujano."
LEY QUE MODIFICA EL TEXTO ÚNICO ORDENADO DE LA LEY DEL SISTEMA PRIVADO DE ADMINISTRACIÓN DE FONDOS DE PENSIONES PARA OTORGARLE MEJORES OPCIONES A LOS AFILIADOS RESPECTO A LA INVERSIÓN DE SUS FONDOS DE PENSIONES POR PARTE DE LAS AFP;Propone modificar los artículos 18-A y 25-D del Texto Único Ordenado del Sistema Privado de Administración de Fondos de Pensiones (SPP), aprobado por el Decreto Supremo 054-97-EF, a efectos de mejorar la administración de los fondos de pensiones del SPP, promoviendo una mayor diversificación de las inversiones realizadas por las Administradoras Privadas de Fondos de Pensiones (AFP) al flexibilizar el límite de inversión en el extranjero, que permita tener mejores beneficios y/o retornos a los afiliados, en concordancia con el derecho a acceder a una pensión digna y decente previsto en la normatividad vigente y en la Constitución Política del Estado
LEY QUE DECLARA DE INTERÉS NACIONAL Y NECESIDAD PÚBLICA PROMOVER EL CULTIVO, PRODUCCIÓN INDUSTRIALIZACIÓN, COMERCIALIZACIÓN Y EXPORTACIÓN DE MORINGA OLEIFERA PARA CONSUMO HUMANO;"Propone regular, formaliza y ordenar la producción, transformación, comercialización y exportación; así como el uso tradicional y moderno de la moringa oleífera, por las propiedades medicinales, industriales, agrícolas y nutricionales."
LEY QUE NORMA ACTIVIDADES DEL PERSONAL DE LAS FUERZAS ARMADAS Y POLICÍA NACIONAL EN ESTADO DE EMERGENCIA SANITARIA;Propone regular, conforme lo estipulado en la presente Ley, las siguientes actividades del personal de las fuerzas armadas y policía nacional hasta el término del estado de emergencia sanitaria.
LEY QUE ASEGURA EL OTORGAMIENTO Y LA CONTINUIDAD DE LA ASISTENCIA ECONÓMICA PARA CONTRIBUIR AL DESARROLLO INTEGRAL DE LAS NIÑAS, NIÑOS Y ADOLESCENTES CUYA MADRE, PADRE O AMBOS HAYAN FALLECIDO A CAUSA DE LA COVID-19, DURANTE LA EMERGENCIA SANITARIA;Propone asegurar el otorgamiento y la continuidad de la asistencia económica para contribuir al desarrollo integral de las niñas, niños y adolescentes cuya madre, padre o ambos hayan fallecido a causa de la COVID-19 durante la Emergencia Sanitaria declarada mediante Decreto Supremo 008-2020-SA y sus prórrogas, implementada a través del artículo 8 del Decreto de Urgencia 020-2021, Decreto de Urgencia que dicta medidas extraordinarias en materia económica y financiera vinculadas a los recursos humanos en salud como respuesta ente la emergencia sanitaria por la COVID-19 y dicta otras disposiciones.
LEY QUE DECLARA DE INTERÉS NACIONAL Y NECESIDAD PÚBLICA LA DEMARCACIÓN DE LOS LIMITES TERRITORIAES ENTRE LOS DEPARTAMENTOS DE JUNÍN Y CUSCO;Propone declarar de interés nacional y necesidad pública la demarcación de los límites territoriales entre los departamentos de Junín y Cusco, en concordancia con las normas vigentes.
LEY QUE PROPONE LA IMPLEMENTACIÓN DE LA JUSTICIA ITINERANTE PARA LA ATENCIÓN DE CASOS DE VIOLENCIA CONTRA LAS MUJERES Y LOS INTEGRANTES DEL GRUPO FAMILIAR;Propone regular la implementación de la justicia itinerante para la atención de casos de violencia contra las mujeres y los integrantes del grupo familiar establecidos en la Ley 30364, promoviéndose una justicia célere, simplificada y accesible para las y los justiciables en los lugares más remotos y de escasos recursos económicos a fin de garantizarse el pleno ejercicio de sus derechos fundamentales en igualdad de condiciones y libre de discriminación.
LEY DE PROMOCIÓN DEL USO DE VEHÍCULOS ELÉCTRICOS;La presente Ley tiene por objeto promover el uso de vehículos eléctricos mediante su exoneración del pago del Impuesto General a las Ventas (IGV) y el Impuesto al Patrimonio Vehicular por el período de 5 años contados a partir de la vigencia de la presente Ley.
LEY QUE DEROGA EL ARTÍCULO 6 QUE ESTABLECE EL INGRESO DE PROFESORES DEL MINISTERIO DE DEFENSA A LA CARRERA PÚBLICA MAGISTERIAL DE LA LEY Nº 29944 DEL DECRETO DE URGENCIA Nº 016-2020;La presente Ley tiene como objeto derogar el artículo 6 del Decreto de Urgencia 016-2020, que establece el ingreso de los profesores del Ministerio de Defensa a la Carrera Magisterial de la Ley 29944 de la Reforma Magisterial.
LEY QUE DECLARA DE INTERÉS NACIONAL Y NECESIDAD PÚBLICA LA SEGURIDAD ALIMENTARIA Y NUTRICIONAL EN CASO DE EMERGENCIAS;Propone declarar de interés nacional y necesidad pública garantizar la seguridad alimentaria y nutricional en caso de Emergencias con énfasis en poblaciones vulnerables.
LEY QUE DEROGA EL DECRETO LEY 25872, POR EL QUE SE DECLARA LA PREVALENCIA DE LOS DECRETOS SUPREMOS QUE DISPUSIERON LA SUSPENSION O LIMITACION DE LOS SISTEMAS DE REAJUSTES DE REMUNERACIONES EN FUNCION A INDICES DE INFLACIÓN O MECANISMOS SIMILARES;Propone derogar el Decreto Ley 25872, Decreto Ley que declara la prevalencia de los decretos supremos que dispusieron la suspensión o limitación de los sistemas de reajustes de remuneraciones en función a inflación o mecanismos similares.
LEY QUE DECLARA OFICIALES E INTANGIBLES LOS SÍMBOLOS Y EMBLEMAS DEL PERÚ;Propone establecer los símbolos y emblemas del Perú, la intangibilidad de forma y la estandarización sus denominaciones. En cumplimiento del mandato contenido en el Artículo 49 de la Constitución Política del Perú, son establecidos en la presente Ley, en concordancia con lo dispuesto por la Ley del 25 de febrero de 1825, Ley de creación del Escudo Nacional, y del Pabellón y Bandera Nacional, y por el Decreto Ley 11323, Disposiciones sobre los Símbolos de la Patria, Símbolos del Estado y Emblemas Nacionales.
LEY DE ACTUALIZACIÓN Y SIMPLIFICACIÓN DE PROCEDIMIENTOS PARA LA INDUSTRIA DE HIDROCARBUROS;Propone promover la reactivación sostenible de la exploración y explotación de hidrocarburos a nivel nacional, empleamdo medidas de simplificación administrativa, así como actualizar y mejorar el marco normativo, a fin de fomentar el desarrollo de las actividades de exploración y explotación de hidrocarburos de manera responsable con el medio ambiente, mediante la modificación de la Ley 26221, Ley Orgánica de Hidrocarburos.
"LEY QUE DECLARA DE NECESIDAD PÚBLICA E INTERES NACIONAL EL PROYECTO INTEGRAL """"MEJORAMIENTO Y AMPLIACIÓN DEL SISTEMA DE AGUA POTABLE Y ALCANTARILLADOS DE LA CIUDAD DE YURIMAGUA EN LA PROVINCIA DE ALTO AMAZONAS, DEPARTAMENTO DE LORETO";"Propone declarar de necesidad pública e interés nacional el proyecto integral """"Mejoramiento y ampliación del Sistema de Agua Potable y Alcantarillados de la Ciudad de Yurimaguas en la provincia de Alto Amazonas, departamento de Loreto."
RESOLUCIÓN LEGISLATIVA QUE APRUEBA EL TRATADO INTEGRAL Y PROGRESISTA DE ASOCIACIÓN TRANSPACÍFICO Y LAS CARTAS CON AUSTRALIA, CANADÁ, MALASIA, NUENA ZELANDA Y VIETNAM;"Propone el Tratado Integral y Progresista de Asociación Transpacífico, firmado el 8 de marzo de 2018 en Santiago, Chile y las Cartas con Australia que reafirman los acuerdos relativos a productos distintivos y terminación del Acuerdo sobre Promoción Recíproca de Inversiones; las Cartas con Canadá sobre industrias culturales; las Cartas con Malasia sobre servicios electrónicos de tarjetas de pago; las Cartas con Malasia sobre no recurso a solución de controversias por la medida disconforme en empresas de propiedad del Estado; las Cartas con Nueva Zelanda sobre el mecanismo de solución de controversias inversionista - Estado; las Cartas con Vietnam sobre servicios electrónicos de tarjetas de pago; las Cartas con Vietnam sobre comercio electrónico; las Cartas con Vietnam relativas al capítulo laboral, y las Cartas con Vietnam sobre productos químicos agrícolas, firmadas el 8 de marzo de 2018 en Santiago, Chile"
RESOLUCIÓN LEGISLATIVA QUE APRUEBA EL ACUERDO ENTRE EL GOBIERNO DE LA REPÚBLICA DEL PERÚ Y EL GOBIERNO DE LA FEDERACIÓN DE RUSIA SOBRE LA PROTECCIÓN MUTUA DE LA INFORMACIÓN CLASIFICADA EN EL ÁMBITO DE LA COOPERACIÓN TÉCNICO - MILITAR;Propone el Acuerdo entre el Gobierno de la República del Perú y el Gobierno de la Federación de Rusia sobre la Protección Mutua de la Información Clasificada en el ámbito de la Cooperación Técnico - Militar, suscrito el 17 de enero de 2017 en la ciudad de Lima, República del Perú.
LEY QUE DECLARA DE INTERÉS NACIONAL Y NECESIDAD PÚBLICA LA DECLARATORIA DE EMERGENCIA AMBIENTAL DEL RÍO CHILLÓN;Propone declarar de interés nacional y necesidad pública la declaratoria de Emergencia Ambiental del Río Chillón, por ser un área de grave contaminación ambiental, ocasionando un problema de salud pública como consecuencia de la contaminación del aire y el agua, constituyendo un peligro real para la salud de la población, conforme lo establece la Ley 28804, Ley que Regula la Declaratoria de Emergencia Ambiental.
LEY QUE PROMUEVE EL DESARROLLO DE CIUDADES INTELIGENTES Y EDUCADORAS EN EL PERÚ;Propone promover el desarrollo de ciudades inteligentes y educadores en el Perú a través del uso de las tecnologías de la información y comunicación, priorizando la educación como herramienta de transformación social situándola como eje centro del proyecto de ciudad.
LEY QUE DECLARA DE NECESIDAD PÚBLICA E INTERÉS NACIONAL LA ELABORACIÓN DEL PLAN ESTRATÉGICO DE DESARROLLO HIDRÁULICO INTEGRAL DE LA REGIÓN DE TUMBES;Propone declarar de necesidad pública e interés nacional, la elaboración del Plan Estratégico de desarrollo Hidráulico Integral de la región de Tumbes.
LEY QUE CREA LA AUTORIDAD NACIONAL TRANSPARENCIA, ACCESO A LA INFORMACIÓN PÚBLICA Y PROTECCIÓN DE DATOS PERSONALES;Propone crear la Autoridad Nacional de Transparencia, Acceso a la Información Pública y Protección de Datos Personales (en adelante, la Autoridad) como ente rector en materia de transparencia, acceso a la información pública y protección de datos personales.
LEY QUE PROMUEVE LA IMPLEMENTACIÓN Y ACONDICIONAMIENTO DE CASAS HOGAR PUBLICAS PARA ADULTOS MAYORES A NIVEL NACIONAL;Propone crear e implementación de casas hogar para los adultos mayores en situación de vulnerabilidad, conforme lo estípula el artículo 9° de la Ley 30490, comprendiendo para ello a aquellos adultos que se encuentran en estado de abandono moral y material.
LEY QUE MODIFICA LA LEY 28090, LEY QUE REGULA EL CIERRE DE MINAS;Propone modificar la Ley 28090, Ley que regula el Cierre de Minas, a fin de adecuar la norma a los cambios que se han producido luego de su emisión y a las competencias actuales que ejercen las entidades involucradas.
LEY QUE DISPONE QUE LOS MIEMBROS DE LA FUERZAS ARMADAS Y POLICIALES, PROCESADOS O CONDENADOS POR DELITO COMUNES, CUMPLAN  DETENCIÓN EN CENTROS DE RECLUSÍON MILITARES O POLICIALES;Propone establecer que los miembros de las Fuerzas Armadas y de la Policía Nacional del Perú, que hayan sido procesados o condenados por delitos comunes, cumplan su pena  restrictiva de la libertad en centros de reclusión militar o policial, según corresponda, a fin de preservar su vida e integridad.
LEY QUE DETERMINA, COMO PENSIÓN MINIMA, LA EQUIVALENTE A UNA REMUNERACIÓN MINIMA VITAL PARA LOS PENSIONISTAS DEL SISTEMA NACIONAL DE PENCIONES;Propone determinar la pasión mínima, que corresponda a una Remuneración Mínima Vital (RMV), para todos los pensionistas pertenecientes al Sistema Nacional de Pensiones, que es administrada por la Oficina de Normalización Previsional (ONP).
LEY QUE DECLARA DE NECESIDAD PÚBLICA E INTERÉS NACIONAL EL RECONOCIMIENTO DE LA EMERGENCIA ALIMENTARIA EN EL PERÚ;Propone declarar de necesidad pública e interés nacional que el Estado peruano reconozca la Emergencia Alimentaria en el Perú y autorice mecanismos de respuesta inmediata y temporal para enfrentar la emergencia, fortaleciendo la Agricultura familiar, las Ollas Comunes y otras iniciativas ciudadanas de respuestas autoorganizada, que buscan garantizar el acceso a alimentos de la población en situación de inseguridad alimentaria en el país.
LEY QUE DECLARA DE INTERÉS NACIONAL Y NECESIDAD PÚBLICA LOS CUIDADOS PALIATIVOS Y EL CONTROL DEL DOLOR EN EL TRATAMIENTO INTEGRAL DEL CÁNCER;Propone declarar de interés nacional y necesidad pública los cuidados paliativos y el control del dolor en el tratamiento integral del cáncer.
LEY QUE CREA EL REGISTRO NACIONAL DIGITAL Y EL OBSERVATORIO NACIONAL CONTRA EL TRABAJO FORZOSO Y LA TRATA DE PERSONAS;Propone implementar el Registro Nacional Digital contra el Trabajo Forzoso y la Trata de Personas, a fin de generar información y conocimiento virtual para el seguimiento y mejorar de las políticas públicas en matería trabajo forzoso y la trata de personas, priorizando de forma especial a las personas y grupos que se encuentran en condición de mayor vulnerabilidad: niños, adolescentes, Personas con discapacidad, miembro de comunidades campesinas u originarios, entre otros.
LEY QUE PROPONE PRIORIZAR EL OTORGAMIENTO DE BECAS DE ESTUDIO A FAVOR DE LAS MUJERES VÍCTIMAS DE VIOLENCIA Y DE LAS HIJAS E HIJOS DE LAS VÍCTIMAS DE FEMINICIDIO QUE QUEDARON EN ORFANDAD;Propone priorizar el otorgamiento de beca de estudio para las víctimas y sobrevivientes de la violencia contra las mujeres, y las hijas e hijos de las víctimas de feminicidio que quedaron en orfandad, como una medida afirmativa con un enfoque integrador y de reparación por parte del Estado para garantizar el acceso de las víctimas de la violencia a la que se refiere la Ley 30364, a la educación en condiciones de igualdad de oportunidades y libre de discriminación.
LEY DEL TRABAJO PORTUARIO MARÍTIMO Y FLUVIAL;Propone regular el trabajo de movilización de carga que se efectúa en los terminales portuarios marítimos y fluviales de uso público de la República, la relación laboral entre los trabajadores portuarios y sus empleados, así como garantizar el cabal cumplimiento de los derechos remunerativos y previsionales.
LEY DEL SERVICIO DE SERENAZGO MUNICIPAL;Propone establecer el marco normativo que regula al serenazgo municipal como parte del servicio de seguridad ciudadana que prestan las municipalidades, regulando actividades que contribuyan a la prevención social de la violencia, los delitos y las faltas, a efectos de promover la convivencia pacífica y la cohesión social e impactar positivamente en el desarrollo humano de los miembros de la comunidad.
LEY QUE DECLARA DE NECESIDAD PÚBLICA E INTERÉS NACIONAL LA PROTECCIÓN INTEGRAL DE NIÑOS Y NIÑAS HUÉFENOS DEL COVID-19;Propone declarar de necesidad pública e interés nacional la protección integral de los niños y niñas menores de edad que han quedado huérfanos de padre y madre a consecuencia del Covid-19.
LEY QUE DECLARA DE INTERÉS NACIONAL Y NECESIDAD PÚBLICA LA CONSTRUCCIÓN DEL PUENTE CARROZABLE ENTRE LAS LOCALIDADES DE SAN ANTONIO (AYACUCHO) Y VILLA KINTIARINA (CUSCO);Propone declarar de interés nacional y necesidad pública la construcción del puente carrozable entre los distritos de San Antonio (Ayacucho) y Villa Kintiarina Alta (Cusco) afín de afianzar la conectividad e integración entre los pueblos del VRAEM.
LEY DE CREACIÓN DEL DISTRITO HUAYCÁN EN LA PROVINCIA Y DEPARTAMENTO DE LIMA;Propone crear el distrito Huaycán, con su capital Huaycán, en la provincia y departamento de Lima (Proyecto actualizado por acuerdo del Consejo Directivo número anterior 5118/2015-PE)
LEY QUE DECLARA DE NECESIDAD PÚBLICA Y DE INTERÉS NACIONAL LA INCLUSIÓN, MEJORAMIENTO Y PROMOCIÓN DE LOS SERVICIOS TURISTICOS DEL VALLE DEL MONZÓN Y LA PROVINCIA DE LEONCIO PRADO;Propone declarar de necesidad pública y de interés nacional la inclusión, mejoramiento y promoción de los servicios turístico del Valle del Monzón y la provincia de Leoncio Prado, en concordancia con la Ley 29408, Ley General de Turismo.
LEY QUE MODIFICA LEY NÚM. 28705, LEY GENERAL PARA LA PREVENCIÓN Y CONTROL DE LOS RIESGOS DEL CONSUMO DEL TABACO, EN CONCORDANCIA CON EL CONVENIO MARCO DE LA ORGANIZACIÓN MUNDIAL DE LA SALUD PARA EL CONTROL DEL TABACO;Propone modificar la Ley núm. 28705, Ley general para la prevención y control de los riesgos del consumo del tabaco, en concordancia con el convenio marco de la organización mundial de la salud para el control del tabaco.
LEY QUE MODIFICA LA LEY 26859 PARA GARANTIZAR EL ACCESO A LA INFORMACIÓN ELECTORAL EN CONDICIONES DE IGUALDAD;Propone reducir a un plazo razonable el periodo de prohibición de publicar encuestas antes de elecciones, de modo que se tutele el derecho a la información de la ciudadanía en su conjunto en el marco de proceso electorales.
LEY QUE DECLARA DE INTERÉS NACIONAL Y DE NECESIDAD PÚBLICA LA CREACIÓN DE LA PROVINCIA DE YARINACOCHA, EN EL DEPARTAMENTO DE UCAYALI;Propone declarar de interés nacional y de necesidad pública la creación de la provincia Yarinacocha nacida del territorio actual de la provincia de Coronel Portillo en el departamento de Ucayali.
