Titulo;Objeto
MODIFICA EL ART. 2 DEL DECRETO SUPREMO  232-2017-EEF QUE FIJA EL MONTO DE LA ENTREGA ECONÓMICA DEL SERVICIO DE GUARDIA EN EL MARCO DE LO ESTABLECIDO EN EL DECRETO LEGISLATIVO 1153, DECRETO LEGISLATIVO QUE REGULA LA POLÍTICA INTEGRAL DE COMPENSACIONES Y ENTREGAS ECONÓMICAS DEL PERSONAL DE LA SALUD;Propone modificar el artículo 2 del Decreto Supremo 232-2017-EF que fija el monto de la entrega económica del servicio de guardia en el marco de lo establecido en el Decreto Legislativo 1153, Decreto Legislativo que regula la política integral de compensaciones y entregas económicas del personal de la Salud al servicio del Estado.
LEY QUE PROMUEVE LA EJECUCIÓN DE PROYECTOS DE INVERSIÓN PARA EL MEJORAMIENTO Y REGULACIÓN DEL  SISTEMA DE RIEGO DE LA CUENCA ALTA, MEDIA Y BAJA DEL RÍO CUNAS;Propone ley que promueve la ejecución de proyectos de inversión para el mejoramiento y regulación del sistema de riego de la cuenca alta, media y baja del río cunas, con la finalidad de construir represas, canales de irrigación y mejoramiento de canales existentes.
LEY QUE MODIFICA EL ARTÍCULO 20 Y 367 DEL CÓDIGO PENAL, EXCENTO DE RESPONSABILIDAD PENAL AL PERSONAL DE LA FUERZA ARMADA Y PNP Y AMPLÍA LAS FORMAS AGRAVADAS;Propone modificar el inciso 11 del artículo 20 y el inciso 3 del artículo 367 del Código Penal, con el objetivo de aplicar acciones inmediatas y con responsabilidad para enfrentar la inseguridad ciudadana en nuestro país.
LEY QUE DECLARA DE NECESIDAD PÚBLICA E INTERÉS  NACIONAL LOS PROYECTOS DE TRANSPORTE DEL GAS, DESARROLLO PETROQUÍMICO Y DE VALOR AGREGADO PARA EL DESARROLLO INTEGRAL DEL SUR PERUANO;Propone declarar de necesidad pública e interés nacional las políticas y proyectos que sustentan para el desarrollo estratégico nacional, en especial de la Macrosur peruana, el adecuado aprovechamaiento de los recursos energéticos, de Petróleo y Gas, incluyendo las perspectivas de integración energética, de Petróleo y Gas.
LEY QUE TRANSFIERE TEMPORALMENTE LA DEPENDENCIA JERÁRQUICA ADMINISTRATIVA Y FUNCIONAL DE LOS DIRECTORES DE LAS DIRECCIONES REGIONALES DE SALUD A NIVEL NACIONAL, AL MINISTERIO DE SALUD Y MODIFICA LA LEY 27867, LEY ORGÁNICA DE GOBIERNOS REGIONALES;Propone declarar de interés público el mejoramiento de la gestión de las Direcciones Regionales de Salud, de tal forma que los Directores Regionales sean designados temporalmente por el órgano rector de las Políticas de Salud a nivel nacional, siendo prioritario que su conducción esté orientada hacia un modelo hospitalario moderno, que brinde servicios oportunos y de calidad.
"AUTORIZACIÓN: INGRESO Y RECALADA DE LA FRAGATA DE VIGILANCIA """"PRAIRIAL"""" (F-731) DE LA MARINA NACIONAL DE FRANCIA";"Propone autorizar el ingreso al territorio de la República de la fragata de vigilancia """"PRAIRIAL"""" (F-731) de la Marina Nacional de Francia, dotada con armamento a bordo UN (1) helicóptero y su tripulación de QUINCE (15) oficiales y OCHENTA (80) tripulantes con la finalidad de que realice una escala de rutina en el puerto del Callao , efectúe vuelos locales (de enlace y navegación) con su aeronave embarcada, cuya solicitud de autorización de sobrevuelo se iniciará dos semanas antes de la llegada del buque, así como realizar ejercicios cotidianos de buceo con botaduras de embarcaciones, en el marco de lo que establecido en numeral 8 del artículo 102 de la Constitución Política del Perú y conforme a las especificaciones que se señalan en el anexo que forma parte integrante de la presente resolución legislativa."
LEY QUE FORTALECE EL SERVICIO DE SERENAZGO MUNICIPAL;Propone fortalecer el servicio de serenazgo municipal, precisando la necesidad de establecer los lineamientos para uniformizar el perfil del sereno, su capacitación, las características de sus uniformes y fundamentalmente, el régimen laboral y los derechos laborales que les corresponde, en el marco de la rectoría que ejerce el Ministerio del Interior sobre el Sistema Nacional de Seguridad Ciudadana.
LEY QUE RECONOCE A LOS COMITÉS DE AUTODEFENSA DEL VRAEM POR SU CONTRIBUCIÓN EN LA PACIFICACIÓN NACIONAL;Propone reconocer a los Comités de Autodefensa del Valle de los Ríos Apurímac, Ene y Mantaro-VRAEM, por su constante contribución en la preservación de la seguridad nacional en apoyo a las FF.AA y PNP en el proceso de pacificación para defender a los ciudadanos de las agresiones, violencia del terrorismo y el narcotráfico.
LEY DE COOPERACIÓN E INTERCAMBIO INTERINSTITUCIONAL DE INFORMACIÓN CRIMINALÍSTICA ENTRE ENTIDADES PÚBLICAS DEL SISTEMA DE JUSTICIA NACIONAL;Propone el intercambio de información criminalística existente en las bases de datos de las entidades que intervienen en el sistema nacional de justicia, a fin de desarrollar un trabajo articulado, recíproco con la finalidad de simplificar los procedimientos de cooperación entre los operadores de justicia para lograr una mayor celeridad en las investigaciones penales y mejorar el actual sistema de justicia en la lucha contra la criminalidad común y organizada.
PROTOCOLO DE NAGOYA-KUALA LUMPUR SOBRE RESPONSABILIDAD Y COMPENSACIÓN SUPLEMENTARIO, AL PROTOCOLO DE CARTAGENA SOBRE SEGURIDAD DE LA BIOTECNOLOGÍA;Propone someter a consideración del Congreso de la República el Protocolo de Nagoya-Kuala Lumpur sobre Responsabilidad y Compensación Suplementario, al Protocolo de Cartagena sobre Seguridad de la Biotecnología, adoptado en Nagoya el 15 de octubre del 2010 y firmado por el Perú el 04 de mayo de 2011.
LEY QUE DEROGA EL DECRETO LEGISLATIVO 1429, DECRETO LEGISLATIVO QUE ACTUALIZA Y FORTALECE LA GESTIÓN INSTITUCIONAL DE LOS ÓRGANOS COLEGIADOS DEL INSTITUTO DE INVESTIGACIONES DE LA AMAZONÍA PERUANA (IIAP);Propone derogar el Decreto Legislativo 1429, Decreto Legislativo que actualiza y fortalece la gestión institucional de los órganos colegiados del Instituto de Investigaciones de la Amazonía Peruana (IIAP).
LEY QUE RESTABLECE EL RÉGIMEN ESPECIAL DE JUBILACIÓN ANTICIPADA PARA  DESEMPLEADOS EN EL SISTEMA PRIVADO DE PENSIONES;Propone Ley que restablece el Régimen Especial de Jubilación Anticipada-REJA creado por la Ley 29426, desde la vigencia de la presente Ley hasta el 31 de diciembre del 2021.
LEY QUE MODIFICA LA LEY ORGÁNICA DEL MINISTERIO PÚBLICO, DECRETO LEGISLATIVO N° 052 Y DECLARA EN EMERGENCIA AL MINISTERIO PÚBLICO;Propone declarar en emergencia el Ministerio Público suspender el ejercicio de las funciones del Fiscal de la Nación, de los Fiscales Supremos Titulares actuales y conformar una Junta Transitoria de Fiscales Supremos a fin de garantizar la autonomía del referido organismo.
LEY QUE MODIFICA EL ARTÍCULO 2 DE LA LEY 27588 E INCORPORA CAUSALES DE IMPEDIMENTOS E INCOMPATIBILIDADES EN EL EJERCICIO DE LA FUNCIÓN EN LA ADMINISTRACIÓN PÚBLICA;Propone modificar el artículo 2 de la Ley que establece prohibiciones e incompatibilidades de funciones y servidores públicos, así como de las personas que presten servicios al Estado bajo cualquier modalidad contractual-Ley 27588.
LEY QUE MODIFICA EL ARTÍCULO 56 Y 97 DEL CÓDIGO PROCESAL CONSTITUCIONAL, CON LA FINALIDAD DE GARANTIZAR EL DERECHO A LA IGUALDAD Y OPTIMIZAR EL PRINCIPIO DE GRATUIDAD.;Propone modificar los artículos 56 y 97 del Código Procesal Constitucional, estableciendo la responsabilidad del pago de costas y costos por parte del demandante cuando su demanda sea desestimada, tenga la condición de persona jurídica con fines de lucro y si incurrió en manifiesta temeridad.
LEY QUE DECLARA DE INTERÉS NACIONAL LA INVESTIGACIÓN, CONSERVACIÓN, PUESTA EN VALOR Y PROMOCIÓN DE LOS SITIOS ARQUEOLÓGICOS EXISTENTES EN LA CUENCA DEL RÍO CHILLÓN, PROVINCIA DE CANTA, DEPARTAMENTO DE LIMA;Propone declarar de interés nacional la investigación, conservación, puesta en valor y promoción de los sitios arqueológicos existentes en la cuenca del río Chillón, distritos de Huaros, Canta, Huamantanga, Lachaqui, San Buenaventura, Santa Rosa de Quives y Arahuay en la provincia de Canta, departamento de Lima.
LEY QUE MODIFICA LA DÉCIMA DISPOSICIÓN COMPLEMENTARIA FINAL DE LA LEY 30220 LEY UNIVERSITARIA, SOBRE EL CENTRO DE ALTOS ESTUDIOS NACIONALES-ESCUELA DE POSGRADO EPG-CAEN;Propone modificar la Décima Disposición Complementaria Modificatoria de la Ley 30220 Ley Universitaria, referida al Centro de Altos Estudios Nacionales-Escuela de Posgrado EPG CAEN, con otras normas dadas con posterioridad referidas al sector o Ministerio al que está adscrito y el tipo de entidad que califica, conforme a la Ley 29158 Ley Orgánica del Poder Ejecutivo
LEY QUE PROMUEVE LA INFORMACIÓN ADECUADA DE PRODUCTOS FARMACÉUTICOS;"Propone garantizar el derecho de acceso a la información de los consumidores de productos farmacéuticos en beneficio de la salud pública, promoviendo a su vez la competencia en el mercado de medicamentos, y prescribiendo la obligatoriedad del uso de la denominación """"Bioequivalente"""" en el rotulado, inserto y ficha técnica, de los productos farmacéuticos que hayan acreditado equivalencia terapéutica, facilitando su adquisición y comercialización y mejorando la competencia en el mercado de medicamentos."
LEY QUE MODIFICA LA LEY DEL SISTEMA PRIVADO DE PENSIONES ESTABLECIENDO PRECISIONES LEGALES A FAVOR DE LOS HEREDEROS BENEFICIARIOS DEL AFILIADO Y/O PENSIONISTA Y QUE DETERMINA EL DESTINO DE LA CUENTA INDIVIDUAL DE CAPITALIZACIÓN EN CASO DE NO EXISTIR HEREDEROS O TESTAMENTO CONFORME A LEY;Propone cautelar el destino y la proporcionalidad de la distribución de las cuentas individuales de capitalización en el caso de muerte del afiliado y/o pensionista a favor de sus herederos, así como el destino de los fondos, en el caso que éste no tenga herederos conforme a Ley.
"LEY QUE CREA EL CONSERVATORIO DE MÚSICA DEL ALTIPLANO """"THEODORO VALCÁRCEL CABALLERO"""" EN LA REGIÓN PUNO";"Propone declarar de interés nacional y necesidad regional la creación del Conservatorio de Música del Altiplano """"Theodoro Valcárcel Caballero"""" para la formación de profesionales especializados en música, formación de docentes en educación musical y formación de artistas profesisonales, idependiente de la escuela superior de formación artística de Puno-ESFAP."
LEY QUE MODIFICA EL ARTÍCULO 1° DE LA LEY 26519, LEY QUE ESTABLECE PENSIÓN PARA EXPRESIDENTES CONSTITUCIONALES DE LA REPÚBLICA;Propone establecer un esquema pensionario digno y justo para los expresidentes Constitucionales de la República acorde a la voluntad del servicio que se les confiere modificando para ello el Artículo 1° de la Ley 26519, Ley que establece pensión para expresidentes Constitucionales de la República.
LEY QUE MODIFICA EL ARTÍCULO 3° DEL DECRETO LEGISLATIVO 1164, QUE ESTABLECE DISPOSICIONES PARA LA EXTENSIÓN DE LA COBERTURA POBLACIONAL DEL SEGURO INTEGRAL DE SALUD EN MATERIA DE AFILIACION AL RÉGIMEN DE FINANCIAMIENTO SUBSIDIADO, CON EL FIN DE EXTENDER LA PROTECCIÓN DE SALUD A JÓVENES Y ADULTOS CON DISCAPACIDAD DEL PROGRAMA INTEGRAL NACIONAL PARA EL BIENESTAR FAMILIAR-INABIF;Propone la Ley que tiene por objeto ampliar la cobertura en el régimen de financiamiento subsidiado del Seguro Integral de Salud (SIS) establecido en el Decreto Legislativo 1164, con el fin de brindar protección en salud a los jóvenes y adultos con discapacidad que residen en los Centros de Atención Residencial públicos y privados, a efectos de garantizar lo establecido en el artículo 7° de la Constitución Política del Perú, respecto al derecho a la salud de todas las personas y a la protección de las personas con discapacidad, consideran que estas últimas tienen derecho al respeto de su dignidad y a un régimen legal de protección, atención, readaptación y seguridad.
LEY QUE IMPONE LA OBLIGACIÓN DE UN TEST DE ORIENTACIÓN PROFESIONAL EN EL CUARTO Y QUINTO AÑO DE EDUCACIÓN SECUNDARIA A FIN DE VIABILIZAR LA MEJOR INSERCIÓN LABORAL DEL FUTURO EGRESADO DE CENTRO DE ESTUDIOS SUPERIORES;La presente Ley tiene por objeto establecer la obligatoriedad de test de orientación profesional a los educando de nivel secundario, en el cuarto y quinto año de formación. Dicho test se deberá realizar durante el segundo bimestre, no pudiendo ser menor a dos y con un espacio de no menos de dos meses entre un test y otro.
LEY QUE PROTEGE Y RECONOCE DERECHOS A LAS FAMILIAS MONOPARENTALES EN SITUACIÓN DE VULNERABILIDAD;Propone la protección y reconocimiento de derechos a las familias monoparentales que se encuentran en estado de necesidad y/o vulnerabilidad económica de carácter progresivo a efectos de fortalecer y salvaguardar el  desarrollo integral de cada uno de sus miembros, considerando que la comunidad y el estado protegen a la familia y las reconoce como Institutos naturales y fundamentales de la sociedad.
LEY QUE PROMUEVE LA INFORMACIÓN ADECUADA Y CORRECTA PROTECCIÓN A LOS CONSUMIDORES DE PRODUCTOS FARMACÉUTICOS;Propone establecer disposiciones con la finalidad de evitar la afectación de los derechos de los consumidores de productos farmacéuticos cuya condición de venta es con receta médica y/o es considerado un alimento de régimen especial, prohibiendo y sancionando el incumplimiento del deber de información y evitando prácticas de abuso de posición de dominio y prácticas colusorias verticales.
LEY QUE CREA EL SISTEMA DE CONTROL DE RECAUDACIÓN DE INGRESOS PROPIOS EN GOBIERNOS LOCALES;Propone crear el Sistema de Control de Recaudación de ingresos propios, de los gobiernos locales, en adelante SICRIP, para fortalecer la transparencia, acceso a la información pública y eficiencia en la gestión de los gobiernos locales.
LEY QUE CREA LA AUTORIDAD NACIONAL DE ASUNTOS INTERNOS DE LA MAGISTRATURA DEL PODER JUDICIAL Y DEL MINISTERIO PÚBLICO;Propone crear la Autoridad Nacional de Asuntos Internos de la Magistratura del Poder Judicial y del Ministerio Público, con la finalidad de que la población a nivel nacional sienta una reforma de justicia integral a cabalidad, sobre las acciones de control respecto a irregularidades funcionales cometidas por Jueces y Fiscales, servidores o empleados del Poder Judicial y del Ministerio Público.
LEY QUE PROHIBE EL USO E INGRESO DE TELÉFONOS MÓVILES Y DISPOSITIVOS ELECTRÓNICOS A INSTITUCIONES EDUCATIVAS PÚBLICAS Y PRIVADAS DURANTE HORARIO DE CLASES POR ESTUDIANTES DE NIVEL PRIMARIA Y SECUNDARIA;Propone prohibir el ingreso y uso de teléfonos móviles y otros dispositivos similares, durante el horario de clases, a Instituciones Educativas Públicas Privadas por estudiantes de nivel primaria y secundaria.
LEY QUE MODIFICA EL TEXTO ÚNICO ORDENADO DE LA LEY GENERAL DE MINERÍA EN LO REFERIDO A LAS GARANTÍAS Y MEDIDAS DE PROMOCIÓN A LA INVERSIÓN;Propone modificar los artículos 72, 80, 83-B, 84 y 85 e incorporar el quinto párrafo al artículo 83-B del Texto Único Ordenado de la Ley General de Mineria en lo referido a las Garantías y Medidas de Promoción a la Inversión, a fin de uniformizar el tratamiento de los beneficios contractuales a los que se refiere dicho texto, establecer el momento que se considera para fijar la fecha de la estabilidad, así como incluir en los alcances de la estabilidad a las inversiones preexistentes.
LEY QUE DECLARA DE NECESIDAD PÚBLICA E INTERÉS NACIONAL LA RECLASIFICACIÓN DEL TERMINAL PORTUARIO DE CHIMBOTE, A UNO DE ALCANCE NACIONAL;Propone declarar de interés nacional y necesidad pública la reclasificación del Terminal Portuario de Chimbote, ubicado en la provincia de Chimbote del departamento de Ancash, a la categoría de Puerto Nacional, conforme a lo establecido en la Ley 27943, Ley del Sistema Portuario Nacional.
LEY QUE DEROGA EL DECRETO LEGISLATIVO 1429;Propone derogar el Decreto Legislativo 1429 que actualiza y fortalece la gestión institucional de los órganos colegiados del Instituto de Investigaciones a Amazónicas de la Amazonía Peruana (IIAP), y restitúiyase los artículos 11 y 12 de la Ley 23374
LEY QUE FORTALECE LOS DERECHOS DE LAS PERSONAS NATURALES Y PUEBLOS QUE RADICAN EN LAS ZONAS ALTO ANDINAS DEL PERÚ;Propone fortalecer los derechos de las personas naturales y pueblos que radican en las zonas geográficas alto andinas del Perú, con la finalidad de promover su desarrollo humano, social integral, inclusivo y comunal, para reducir las brechas que existen en materia de desigualdades y oportunidades.
LEY QUE DECLARA DE INTERÉS PÚBLICO MEJORAR LOS ESTÁNDARES DE CALIDAD Y SEGURIDAD EN LOS VEHÍCULOS QUE INGRESAN AL MERCADO NACIONAL;Propone declarar de interés público el establecimiento de nuevos y mejores estándares basicos en la calidad y seguridad de los vehículos que ingresan al mercado nacional, con la finalidad de reducir el nivel de riesgo de conductores y usuarios de vehículos, así como de peatones, en los accidentes de tránsito.
LEY QUE DEROGA EL DECRETO LEGISLATIVO 1429, DECRETO LEGISLATIVO QUE ACTUALIZA Y FORTALECE LA GESTIÓN INSTITUCIONAL DE LOS ÓRGANOS COLEGIADOS DEL INSTITUTO DE INVESTIGACIONES DE LA AMAZONÍA PERUANA (IIAP);"Propone la derogación del Decreto Legislativo 1429, Decreto Legislatiivo que actualiza y fortalece la gestión institucional de los Órganos Colegiados del Instituto de Investigaciones de la Amazonía Peruana (IIAP); y, no se contrapone con ninguna forma constitucional ni disposición vigente con rango de Ley, por el contrario, se corrigen infracciones a la Constitución Política del Estado, al Convenio N° 169 de la OIT, y Políticas de Estado y del Acuerdo Nacional."
LEY QUE INCORPORA LOS ARTÍCULOS 84 Y 85 EN EL DECRETO LEGISLATIVO 1278, QUE APRUEBA LA LEY DE GESTIÓN INTEGRAL DE RESIDUOS SÓLIDOS;Propone incorporación de los artículos 84 y 85 en el Decreto Legislativo 1278, que aprueba la Ley de Gestión Integral de los Residuos Sólidos.
LEY QUE PROMUEVE LA ADOPCIÓN DE LA PERSPECTIVA DE IGUALDAD ENTRE MUJERES Y HOMBRES Y EXCLUYE DEL ORDENAMIENTO JURÍDICO Y LAS POLÍTICAS PÚBLICAS TODO TÉRMINO QUE HAGA REFERENCIA A LA IDEOLOGÍA DE GÉNERO Y A CUALQUIER OTRO QUE ATENTE CONTRA LA IGUALDAD ENTRE MUJERES Y HOMBRES;Propone ley que promueve la adopción de la perspectiva de igualdad entre mujeres y hombres y excluye del ordenamiento jurídico y las políticas públicas todo término que haga referencia a la ideología de género y a cualquier otro que atente contra la igualdad entre mujeres y hombres.
LEY QUE CREA LA AUTORIDAD NACIONAL DE INTEGRIDAD Y CONTROL DEL PODER JUDICIAL;Propone crear la Autoridad Nacional de Integridad y Control del Poder Judicial.
RESOLUCIÓN LEGISLATIVA DEL CONGRESO QUE RESTITUYE LOS ARTÍCULOS 22, 37 Y 76 DEL REGLAMENTO DEL CONGRESO, QUE SE ENCONTRABAN VIGENTES EL 1 DE AGOSTO DEL 2016,;Propone Resolución Legislativa del Congreso que restituye los artículos 22, 37 y 76 del Reglamento del Congreso de la República.en lo referente a los Grupos Parlamentarios y la posibilidad de los parlamentarios para poder adherirse a un grupo constituido o formar uno nuevo.
LEY QUE FOMENTA LA TRANSPARENCIA EN LA FASE DE EJECUCIÓN CONTRACTUAL DE PROYECTOS DE ASOCIACIÓN PÚBLICO PRIVADO REGULADOS POR EL DECRETO LEGISLATIVO 1362 Y LA LEY 29230;Propone ley que fomenta la transparencia y prevenir actos de corrupción en la ejecución de proyectos de inversión pública con participación del sector privado.
LEY DEL SERVICIO DE TRANSPORTE ESCOLAR PRIVADO;Propone regular el transporte  escolar privado, disponiendo medidas para garantizar el acceso a éste y la seguridad de los menores de edad y los padres de familia usuarios.
LEY QUE DEROGA EL DECRETO LEGISLATIVO 1429, QUE ACTUALIZA Y FORTALECE LA GESTIÓN INSTITUCIONAL DE LOS ÓRGANOS COLEGIADOS DEL INSTITUTO DE INVESTIGACIONES DE LA AMAZONÍA PERUANA (IIAP);Propone derogar el Decreto Legislativo 1429 que actualiza y fortalece la gestión institucional de los órganos colegiados del Instituto de Investigaciones de la Amazonía Peruana (IIAP).
LEY QUE ESTABLECE MEDIDAS PARA GARANTIZAR LA PROTECCIÓN A LA MADRE GESTANTE Y AL RECIÉN NACIDO EN LOS SISTEMAS DE SEGURIDAD SOCIAL DE ESSALUD Y EL SISTEMA INTEGRAL DE SALUD (SIS);Propone establecer medidas destinadas a garantizar la cabal protección a las madres gestantes afiliadas a los sistemas de seguridad social, en el régimen contributivo de ESSALUD y en las diversas modalidades contributivas y semicontributivas del Seguro Integral de Salud (SIS), mediante la cobertura de atención de salud para el control del embarazo, la atención del parto y los cuidados posteriores a la madre y del recién nacido.
LEY DE REFUNDACIÓN DE LOS PARTIDOS POLÍTICOS Y MODIFICA OTRAS DISPOSICIONES DE LA LEY 28094, LEY DE ORGANIZACIONES POLÍTICAS;Propone que los partidos políticos inscritos con inscripción vigente en el Registro de Organizaciones Políticas, se reinscriban, cumpliendo nuevos requisitos previstos en la Ley 28094, Ley de Organizaciones Políticas.
LEY QUE REGULA EL USO Y EL ACCESO A LOS TRATAMIENTOS DE REPRODUCCIÓN HUMANA ASISTIDA;Propone regular la utilización y el acceso integral a las técnicas de reproducción humana asistida por parte de la población, así como los requisitos mínimos que deben cumplir los centros y/o servicios de salud que las realicen.
LEY QUE ESTABLECE LA EJECUCIÓN HUMANITARIA DE LA PENA;Propone establecer la modalidad de Ejecución Humanitaria de la Pena, con el fin de tutelar la dignidad, integridad física, mental y salud de los adultos mayores y de las personas con discapacidad severa permanente, que se encuentran con pena privativa de la libertad.
LEY QUE DECLARA DE NECESIDAD PÚBLICA E INTERÉS NACIONAL LA APROBACIÓN Y EJECUCIÓN DEL PROYECTO TREN DE LA COSTA;Propone declarar de necesidad pública y de interés nacional la aprobación y ejecución del Proyecto Tren de la Costa, cuyo ámbito de influencia incluye a las regiones de Ica, Lima, Ancash, La Libertad, Lambayeque y  Piura, en el marco de la legislación vigente.(Proyecto actualizado por acuerdo del Consejo Directivo del 25.09.2018 núm. anterior 3345/2013-CR)
LEY QUE PRECISA EL ACCESO AL SISTEMA DE SEGURIDAD SOCIAL EN SALUD Y PENSIONES DE LOS PRESTADORES DE SERVICIO DE TRANSPORTE PÚBLICO ESPECIAL DE PASAJEROS EN VEHÍCULOS MENORES-MOTOTAXI;Propone el acceso al sistema de seguridad social en salud y pensiones de los prestadores de servicio de transporte público especial de pasajeros en vehículos menores-mototaxi.
LEY PARA INCORPORAR NUEVO SUPUESTO DE CANCELACIÓN Y DECLARATORIA DE ILEGALIDAD DE ORGANIZACIONES POLÍTICAS POR CONDUCTAS FRAUDULENTAS Y ANTIDEMOCRÁTICAS;"Propone modificar los artículos 13 y 14 de la Ley 28094, Ley de Organizaciones Políticas, de tal forma que se puedan incorporar entre las causales que permiten la cancelación de la inscripción en el Registro de Organizaciones Políticas por conducta antidemocrática y la declaratoria de ilegalidad de una organización política; la entrega de información o documentación fraudulenta durante el proceso de inscripción de una organización política."
LEY QUE INCORPORA AL RÉGIMEN LABORAL DEL DECRETO LEGISLATIVO 728, 276 A LOS TRABAJADORES QUE SE ENCUENTRAN BAJO EL RÉGIMEN CAS, EN LAS UNIVERSIDADES PÚBLICAS;Propone incorporación al régimen laboral del Decreto Legislativo 728, Ley de Productividad y Competitividad Laboral y 276, Ley de Bases de la Carrera Administrativa y de Remuneraciones del Sector Público, según corresponda, a los trabajadores que actualmenete vienen laborando bajo el Régimen de Contrato Administrativo de Servicios-CAS, en las universidades públicas del país.
LEY QUE PERMITE QUE LOS REVOCADOS POR OMISIÓN DE PRESTACIÓN DE ALIMENTOS PUEDAN RECOBRAR LA LIBERTAD AUTOMATICAMENTE PREVIA CANCELACIÓN DE LA REPARACIÓN CIVIL EXCLUYÉNDOSE EN LOS CASOS DE REINCIDENCIA;Propone incluir el segundo párrafo del artículo 52 del Decreto Legislativo 635 del Código Penal, con la finalidad que las personas revocadas por el delito de Omisión de Prestación de Alimentos puedan recobrar su libertad siempre y cuando paguen la totalidad de la reparación civil a fin de ayudar a otros hijos alimentistas que mantiene en otros hogares.
LEY QUE MEJORA LA SEGURIDAD VIAL EN EL SECTOR SERPENTÍN DE PASAMAYO DE LA RED VIAL N° 5 TRAMO ANCÓN-HUACHO-PATIVILCA;Propone establecer disposiciones para mejorar la seguridad vial en el sector serpentín de pasamayo, con la finalidad de proteger la vida de los usuarios que transitan por la red vial Nro.5 tramo Ancón-Huacho-Pativilca de la carretera Panamericana Norte.
LEY QUE DECLARA DE PREFERENTE INTERÉS NACIONAL Y SOCIAL LA DETERMINACIÓN DE LA PENSIÓN MÍNIMA PARA LOS PENSIONISTAS DEL SISTEMA NACIONAL DE PENSIONES;Propone declarar de preferente interés nacional y social determinar una pensión mínima mensual, equivalente a una remuneración mínima vital, para los pensionistas pertenecientes al Sistema Nacional de Pensiones, que administra la Oficina de Normalización Previsional (ONP)
LEY QUE INCORPORA UN PÁRRAFO EN EL ARTÍCULO 3 DE LA LEY 26790, PRECISANDO QUE LOS HIJOS MAYORES DE EDAD INCAPACITADOS PARA EL TRABAJO NO PIERDEN SU CONDICIÓN DE DERECHOHABIENTES EN CASO ACCEDAN A LOS PROGRAMAS DE FOMENTO AL EMPLEO TEMPORAL;Propone incorporar un párrafo en el artículo 3 de la Ley 26790 Ley de Modernización de la Seguridad Social en Salud, a fin de precisar que los hijos mayores de edad incapacitados para el trabajo, no pierdan su condición de derechohabientes en caso accedan a los programas de fomento al empleo temporal del Ministerio de Trabajo y Promoción del Empleo que señala el artículo 46 de la Ley 29973
