Titulo;Objeto
LEY  QUE HABILITA A LOS EX APORTANTES DE LA LEY 30003 LEY QUE REGULA EL RÉGIMEN ESPECIAL DE SEGURIDAD SOCIAL PARA LOS TRABAJADORES Y PENSIONISTAS PESQUEROS, A SOLICITAR LA DEVOLUCIÓN DE SUS APORTES AL SISTEMA PÚBLICO DE PENSIONES;Propone el procedimiento que permita a los ex aportantes de la Ley 30003, Ley que regula el régimen especial de seguridad social para los trabajadores y pensionistas pesqueros, mayores de 55 años, administrados por la Oficina de Normalización Previsional (ONP), a la entrada en vigor de la presente ley.
LEY QUE RECONOCE EL DERECHO DE LOS AFILIADOS A LA DEVOLUCIÓN TOTAL DE SUS APORTES DEL FONDO DE PENSIONES A CARGO DE LA OFICINA DE NORMALIZACIÓN PREVISIONAL (ONP);Propone reconocer el derecho de las personas afiliadas al Sistema Nacional del Pensiones (SNP), estableciendo el mecanismo para solicitar la devolución del monto que aportaron al Fondo de sus pensiones administrado a cargo de la Oficina de Normalización Previsional (ONP).
LEY QUE AUTORIZA EL RETIRO FACULTATIVO TOTAL DE APORTES EN EL SISTEMA PRIVADO DE ADMINISTRACIÓN DE FONDOS DE PENSIONES Y DICTA OTRAS DISPOSICIONES PARA SALVAGUARDAR AL AFILIADO;Propone autorizar a los afiliados al Sistema Privado de Pensiones, para que de forma voluntaria puedan retirar el 100% (cien por ciento) del total de sus fondos acumulados en su cuenta individual de capitalización cuando no registren aportaciones ni retención por más de 12 meses consecutivos.
LEY DE REFORMA CONSTITUCIONAL QUE PROPONE LA REFORMA TOTAL DE LA CONSTITUCIÓN VÍA ASAMBLEA CONSTITUYENTE;Propone modificar en parte el artículo 206 de la Constitución Política del Perú, a fin de proponer que la reforma total de la Constitución se realice por medio de una Asamblea Constituyente
LEY DE PROTECCIÓN DE LA SOCIEDAD FRENTE AL DESECHO DE EQUIPOS DE PROTECCIÓN PERSONAL USADOS;Propone establecer la seguridad sanitaria de la población con el adecuado manejo de los residuos considerados bio contaminados a fin de disminuir la propagación del Coronavirus (COVID-19) y otras enfermedades, así como la contaminación ambiental.
RESOLUCIÓN LEGISLATIVA DEL CONGRESO QUE MODIFICA EL ARTÍCULO 89 DEL REGLAMENTO DEL CONGRESO DE LA REPÚBLICA, PARA DAR TRÁMITE PREFERENTE A LAS DENUNCIAS CONSTITUCIONALES QUE PRESENTE EL MINISTERIO PÚBLICO;Proyecto de Resolución Legislativa del Congreso que modifica el artículo 89 del Reglamento de l Congreso de la República, para dar trámite preferente a las Denuncias Constitucionales que presente el Ministerio Público
LEY QUE MODIFICA EL DECRETO LEGISLATIVO 1153, DECRETO LEGISLATIVO QUE REGULA LA POLÍTICA INTEGRAL DE COMPENSACIONES Y ENTREGAS ECONÓMICAS DEL PERSONAL DE LA SALUD AL SERVICIO DEL ESTADO, REFERIDO A LA ASIGNACIÓN ESPECIAL A FAVOR PERSONAL DE LA SALUD QUE PRESTA SERVICIOS EN EL ÁMBITO DEL VALLE DE LOS RÍOS APURÍMAC, ENE Y MANTARO;Proyecto de Ley que modifica el Decreto Legislativo 1153, Decreto Legislativo que regula la política integral de compensaciones y entregas económicas del personal de la salud al servicio del Estado, referido a la asignación especial a favor del personal de la salud que presta servicios en el ámbito del Valle de los Ríos Apurímac, Ene y Mantaro
LEY DE SEGURIDAD INFORMÁTICA Y  REPRESIÓN DE LOS DELITOS INFORMÁTICOS;Proyecto de Ley de Seguridad Informática y Represión de los Delitos Informáticos
LEY DE REFORMA CONSTITUCIONAL QUE ESTABLECE EL DERECHO A LA ALIMENTACIÓN Y LA SEGURIDAD ALIMENTARIA;Propone modificar los artículos 10 y 88 de la Constitución Política del Estado, que establece el derecho a la alimentación y la seguridad alimentaria.
"LEY QUE DECLARA DE NECESIDAD PÚBLICA E INTERÉS NACIONAL LA IMPLEMENTACIÓN DE UN FONDO """"REACTIVA AGRO"""" PARA LA PEQUEÑA AGRICULTURA FAMILIAR";"Propone declarar de necesidad pública e interés nacional la implementación de un fondo """"Reactiva Agro"""" para promover el financiamiento, a efectos de reactivar el desarrollo de la pequeña agricultura familiar y garantizar la seguridad alimentaria en nuestro país."
LEY QUE AUTORIZA EL NOMBRAMIENTO DE AUXILIARES DE EDUCACIÓN QUE LABORAN EN LAS INSTITUCIONES Y PROGRAMAS PÚBLICOS DE EDUCACIÓN BÁSICA, REGULAR Y ESPECIAL;Propone autorizar al Ministerio de Educación (Minedu) a efectuar el nombramiento de personal auxiliar de educación de las instituciones educativas y programas públicos educativos de Educación Básica, Regular y Especial, que a la entrada en vigencia de la presente ley se encuentren prestando servicios en la condición de contratados bajo cualquier modalidad.
LEY QUE DECLARA EN EMERGENCIA NACIONAL EL SISTEMA EDUCATIVO EN EL PERÚ Y PROPONE SU REFORMA INTEGRAL;Propone declarar en emergencia el sistema educativo nacional y reformarlo integralmente a fin de superar la aguda crisis que ésta atraviesa en todos sus niveles y sus modalidades de la educación básica y superior, agudizada por la emergencia sanitaria del COVID-19
LEY DE REFORMA INTEGRAL AL SISTEMA PERUANO DE PENSIONES;Propone una reforma integral al sistema peruano de pensiones, implementando un sistema multipilar basado en principios de universalidad subjetiva, solidaridad, eficiencia y equidad.
LEY QUE MODIFICA EL CÓDIGO PENAL Y EL CÓDIGO PROCESAL PENAL PARA ASEGURAR LA REPARACIÓN CIVIL INTEGRAL A LAS VÍCTIMAS DE TRATA DE PERSONAS Y DE EXPLOTACIÓN EN TODAS SUS FORMAS;Proyecto de Ley que modifica el Código Penal y el Código Procesal Penal para asegurar la reparación civil integral a las víctimas de trata de personas y de explotación en todas sus formas
LEY QUE DECLARA DE NECESIDAD PÚBLICA E INTERÉS NACIONAL LAS ACTIVIDADES DE PREPARACIÓN DE ALIMENTOS Y APOYO SOCIAL QUE BRINDAN LOS COMEDORES POPULARES;Propone declarar de necesidad pública e interés nacional las actividades de preparación de alimentos y apoyo social que brindan los Comedores Populares, con el propósito de ampliar los lugares de atención, para que sean beneficiadas un mayor número de personas, que se encuentran en situación de vulnerabilidad y de inseguridad alimentaria, por no disponer de recursos para cubrir las necesidades alimenticias de sus familias, por efecto de las medidas de emergencia dictadas para combatir el COVID-19
LEY QUE PROMUEVE LA AGROEXPORTACIÓN Y LA SEGURIDAD ALIMENTARIA NACIONAL;Proyecto de Ley que promueve la Agroexportación y la Seguridad Alimentaria Nacional
LEY QUE REGULA EL ROTULADO ESPECIAL DE MEDICAMENTOS GENÉRICOS Y PROMUEVE EL DESARROLLO DE MEDICAMENTOS BIOEQUIVALENTES PARA GARANTIZAR LA CANTIDAD Y SEGURIDAD DE LOS PRODUCTOS GENÉRICOS;Proyecto de Ley que regula el rotulado especial de medicamentos genéricos y promueve el desarrollo de medicamentos bioequivalentes para garantizar la calidad y seguridad de los productos genéricos
LEY QUE GARANTIZA EL ACCESO A LOS CONSUMIDORES AL OXÍGENO MEDICINAL DE CONCENTRACIÓN NO MENOR AL 93% POR LOS PRÓXIMOS 10 AÑOS;Propone garantizar el acceso a los consumidores de Oxígeno Medicinal de concentración no menor al 93%, conforme a los estándares internacionales y recomendaciones de la Organización Mundial de la Salud, por los próximos 10 años,
LEY QUE DECLARA DE INTERÉS NACIONAL Y NECESIDAD PÚBLICA DENOMINAR A LA AGRICULTURA Y LA GANADERIA COMO ACTIVIDADES ESTRATÉGICAS PARA GARANTIZAR LA SEGURIDAD Y SOBERANÍA ALIMENTARIA;Propone declarar de interés nacional y necesidad pública denominar a la agricultura y la ganaderia como actividades estratégicas para garantizar la seguridad y soberania alimentaria.
LEY DE ELIMINACIÓN DE LAS AFPS Y DE CREACIÓN DEL NUEVO SISTEMA PREVISIONAL UNIFICADO PARA EL OTORGAMIENTO DE PENSIONES UNIVERSALES DIGNAS;Propone declarar de interés nacional y necesidad pública la reforma integral del sistema nacional de pensiones y la creación del Sistema Unificado de Jubilación y Pensiones-SUJP, con la finalidad de establecer principios, lineamientos y modificacicones normativas necesarias para la unificación de los regímenes de pensiones públicos y privados, que permita una pensión universal, digna justa, equitativa y oportuna a favor de la población en edad de jubilación.
LEY DE FORTALECIMIENTO DE LOS DERECHOS DE SALUD DE LOS CONSUMIDORES;Propone fortalecer los derechos de salud de los ciudadanos, brindando las herramientas legales a la Superintendencia Nacional de Salud (SUSALUD) para hacerlos cumplir y establecer sanciones disuasivas por las infracciones y malas prácticas en el mercado, conforme a los artículos 7 y 9 de la Constitución Política del Perú, que establece que todas las personas tienen derecho a la protección de su salud, la del medio familiar y la de la comunidad.
LEY QUE CREA EL SISTEMA INTEGRAL DE PENSIONES;Propone un Sistema Provisional Integral, universal sostenible que garantice el derecho de todos los ciudadanos a gozar de una pensión digna a la edad de jubilación, independiente de su condición económica o social y del régimen de la actividad económica o laboral que realice durante su vida.
LEY QUE PROMUEVE EL PAGO OPORTUNO A LAS MIPYME QUE SON PROVEEDORES DEL ESTADO;Ley tiene por objeto que se cumpla con el pago oportuno las prestaciones contractualmente pactadas con las micro, pequeñas y medianas empresas (MIPYME) que son proveedoras del Estado.
LEY QUE MODIFICA EL ARTÍCULO 39 DE LA LEY 29459, PARA DEFENSA AL CONSUMIDOR PARA PROMOVER LA PUBLICIDAD DE INFORMACIÓN COMPARATIVA DE PRECIOS Y PRODUCTOS FARMACÉUTICOS Y DISPOSITIVOS MÉDICOS;
LEY QUE ESTABLECE MEDIDAS EXCEPCIONALES A FAVOR DE LAS MUNICIPALIDADES PROVINCIALES Y DISTRITALES PARA GARANTIZAR PAGO DE SERVICIOS ESENCIALES;Propone establecer medidas excepcionales a favor de las Municipalidades Provinciales y Distritales para el Ejercicio 2020, para financiar sus gastos referidos al mantenimiento de los servicios de la ciudad, limpieza pública, recojo de residuos sólidos, seguridad ciudadana, fiscalización y control municipal y aquellas indispensables al manejo institucional, incluyendo el pago de los pensionistaas, servidores bajo los regímenes del Decreto Legislativo 276, Decreto Legislativo 728 y los Trabajadores CAS.
LEY QUE ESTABLECE MEDIDAS PARA GARANTIZAR LA TRANSPARENCIA Y ERRADICAR EL APROVECHAMIENTO ECONÓMICO ABUSIVO DE LAS CLÍNICAS PRIVADAS;Propone establecer disposiciones que garanticen la transparencia, el derecho a la información y la protección de los/as usuarios de los servicios de salud brindados por establecimientos de salud de titularidad privada, en adelante, establecimientos privados.
LEY QUE REGULA LA TELEDUCACIÓN COMUNITARIA EN LA EDUCACIÓN BÁSICA Y SUPERIOR;Propone regular la teleducación comunitaria, aplicable en la educación básica y superior, mediante el empleo del uso de las Tecnologías de Información y Comunicación-TIC, como herramienta tecnológica de educación a distancia o diferida entre los actores del proceso educativo, que propician el aprendizaje autónomo y continuo
LEY QUE SUSPENDE EL COBRO DE LOS SERVICIOS PÚBLICOS DE ENERGÍA ELÉCTRICA, AGUA Y ALCANTARILLADO, GAS NATURAL DOMICILIARIO, TELECOMUNICACIONES E INTERNET DURANTE LA DECLARACIÓN DE ESTADO DE EMERGENCIA NACIONAL;Propone declarar de necesidad pública e interés nacional la suspensión del cobro de los servicios públicos de energía eléctrica, agua y alcantarillado, gas natural domiciliario, telecomunicaciones e internet, en situaciones de excepción constitucional por declaraciòn de estado de emergencia o de estado de sitio a nivel nacional, a fin de salvaguardar los derechos de los usuarios al acceso y disponibilidad de dichos servicios, garantizando el nivel de suficiencia, seguridad, calidad y continuidad previsto en los contratos de suministro correspondiente.
LEY SOBRE ROL DE LOS GOBIERNOS LOCALES EN SITUACIONES DE EMERGENCIA;Propone que las municipalidades provinciales y distritales deberán  organizar, planificar y ejecutar acciones de prevención y atención de emergencias sociales, conforme a la realidad de sus comunidades, en ejercicio pleno de su autonomía, coordinando con las instancias respectivas de los gobiernos nacional, regional y provincial en lo que corresponda.
LEY QUE DECLARA DE INTERÉS NACIONAL Y NECESIDAD PÚBLICA LA PROTECCIÓN Y PROMOCIÓN DE LA ACTIVIDAD AGRÍCOLA, PECUARIA Y DE AGRICULTURA FAMILIAR COMO ACTIVIDADES ESTRATÉGICAS PARA LA SEGURIDAD ALIMENTARIA DEL PERÚ;Propone declarar de interés nacional y necesidad pública la protección y promoción de la actividad agrícola, pecuaria y de agricultura familiar como actividades estratégicas para la seguridad alimentaria del país con criterios de sostenibilidad e interculturalidad.
"LEY QUE MODIFICA LA LEY 27728 """"LEY DEL MARTILLERO PÚBLICO"""";  LA LEY 30229 """"LEY QUE ADECÚA EL USO DE LAS TECNOLOGÍAS DE INFORMACIÓN Y COMUNICACIONES EN EL SISTEMA DE REMATES JUDICIALES Y EN LOS SERVICIOS DE NOTIFICACIONES DE LAS RESOLUCIONES JUDICIALES, Y QUE MODIFICA LA LEY ORGÁNICA DEL PODER JUDiCIAL, EL CÓDIGO PROCESAL CIVIL, EL CÓDIGO PROCESAL CONSTITUCIONAL Y LA LEY PROCESAL DEL TRABAJO"""";; Y EL ARTÍCULO 731 DEL CÓDIGO PROCESAL CIVIL";Propone la modificación del artículo 3, el numeral 1 del artículo 12, y los numerales 1,2, 4 y 7  del artículo 24 de la Ley 27728, Ley del Martillero Público
LEY QUE AUTORIZA AL BANCO CENTRAL  DE RESERVA DEL PERÚ A FIJAR TASAS DE INTERÉS MÁXIMO EN CASOS DE EMERGENCIA NACIONAL CONFORME AL INCISO 1 DEL ARTÍCULO 137 DE LA CONSTITUCIÓN;Propone regular que en casos de Emergencia Nacional decretados por el Poder Ejecutivo en el marco del inciso 1 del artículo 137 de la Constitución Política del Perú, el Banco Central de Reserva del Perú se encuentre habilitado de fijar las tasas de interés máximo a fin de regular alguna asimetría en el mercado.
LEY QUE MODIFICA LA LEY 29248 LEY DEL SERVICIO MILITAR;Propone modificar la Ley del Servicio Militar con la finalidad de establecer incentivos que permitan que aquellos peruanos a partir de los 18 años de edad puedan ser preparados para contribuir en la defensa de la soberanía e integridad territorial y el desarrollo nacional, prestando apoyo social y humanitario, promover el respeto y amor a los valores patrios, símbolos y tradiciones culturales, y a coadyuvar a su desarrollo y laboral para el futuro.
LEY QUE GARANTIZA EL DERECHO DE LOS TRABAJADORES A LA SEGURIDAD Y SALUD EN EL TRABAJO ANTE RIESGO EPIDEMIOLÓGICO Y SANITARIO;Poryecto de Ley que garantiza el derecho de los trabajadores a la seguridad y salud en el trabajo ante riesgo epidemiológico y sanitario
LEY DE SOBERANÍA Y SEGURIDAD ALIMENTARIA Y NUTRICIONAL;Proyecto de Ley de Soberanía y Seguridad Alimentaria y Nutricional
LEY QUE RECONOCE EL DERECHO DE LOS AFILIADOS A LA DEVOLUCIÓN TOTAL DE SUS APORTES DEL FONDO DE PENSIONES A CARGO DE LA OFICINA NORMALIZACIÓN PREVISIONAL ONP;Proyecto de Ley que reconoce el Derecho de los Afiliados a la Devolución Total de sus Aportes del Fondo de Pensiones a cargo de la Oficina de Normalización Previcional ONP
LEY QUE ELIMINA LA PENSIÓN VITALICIA DE EX PRESIDENTES DE LA REPÚBLICA;Propone  derogar el beneficio de pensión vitalicia otorgada a los ex Presidenrtes de la República, mediante la Ley 26519, establecen pensión para ex Presidentes Constitucionales de la República, en razón del derecho a la igualdad de las personas, la subsistencia de brechas sociales, así como de la crisis que actualmente vive nuestro país
RESOLUCIÓN LEGISLATIVA QUE MODIFICA EL ARTÍCULO 22 Y 87 DEL REGLAMENTO DEL CONGRESO QUE REDUCE EL PLAZO PARA LA ENTREGA DE INFORMACIÓN SOLICITADA POR LOS CONGRESISTAS A LOS ÓGANOS DE LA ADMINISTRACIÓN PÚBLICA Y CUYO INCUMPLIMIENTO GENERA RESPONSABILIDAD PENAL;Resolución LEgislativa que modifica el artículo 22 y 87 del Reglamento del Congreso que reduce el plazo para la entrega de información solicitada por los congresistas a los órganos de administración púbica y cuyo incumplimiento genera responsabilidad penal
LEY QUE RECONOCE A LOS COMITÉS DE AUTODEFENSA Y DESARROLLO RURAL E INCORPORA EN EL SISTEMA DE SEGURIDAD CIUDADANA;Proyecto de Ley que reconoce a los comités de autodefensa y desarrollo rural e incorpora en el sistema de seguridad ciudadana
LEY QUE ESTABLECE LA ELIMINACIÓN DEL RÉGIMEN ESPECIAL DEL DECRETO 1057 Y DISPONE LA INCORPORACIÓN DE TODOS LOS TRABAJADORES PERMANENTES A LOS RÉGIMENES LABORALES VIGENTES;Proyecto de Ley que establece la eliminación del Régimen Especial del Decreto 1057 y dispone la incorporación de todos los trabajadores permanentes a los Régimenes laborales vigentes
LEY QUE DECLARA LA AGRICULTURA COMO ACTIVIDAD ESTRATÉGICA DEL GOBIERNO PARA ASEGURAR LA SEGURIDAD ALIMENTARIA Y AFRONTAR LAS CONSECUENCIAS DE LA PANDEMIA, COVID-19;Proyecto de Ley que declara  la agricultura como actividad estratégica del Gobierno para asegurar la seguridad alimentaria y afrontar las consecuencias de la pandemia COVID-19
LEY QUE ESTABLECE BONIFICACIÓN EXCEPCIONAL PARA TRABAJADORES DEL PROGRAMA INTEGRAL NACIONAL PARA EL BIENESTAR FAMILIAR - INABIF QUE LABORES PRESENCIALMENTE EN EL ESTADO DE EMERGENCIA PARA PREVENIR Y CONTROLAR LA PROPAGACIÓN DEL CORONAVIRUS (COVID-19) EN EL TERRITORIO NACIONAL;Proyecto de Ley que establece bonificación excepcional para trabajadores del Programa Integral Nacional para el Bienestar Familiar - INABIF que labores presencialmente en el Estado de Emergencia para prevenir y controlar la propagación del coronavirus (COVID-!9) en el territorio nacional
LEY DE REACTIVACIÓN DEL SECTOR AGRARIO Y RECONVERSIÓN DEL SEGURO AGRÍCOLA CATASTRÓFICO EN UN SEGURO INTEGRAL;Proyecto de Ley de reactivación del sector agrario y reconversión del seguro agrícola catastrófico en un seguro integral
LEY QUE ESTABLECE LA ELIMINACIÓN DEL RÉGIMEN DEL CONTRATO ADMINISTRATIVO DE SERVICIOS Y GARANTIZA LA IGUALDAD DE DERECHOS EN EL EMPLEO PÚBLICO;Proyecto de Ley que establece la eliminación del Régimen del Contrato Administrativo de Servicios y garantiza la igualdad de Derechos en el Empleo Público
LEY QUE INCORPORA AL PERSONAL EN SITUACIÓN DE RETIRO DE LA POLICÍA NACIONAL DEL PERÚ Y DE LAS FUERZAS ARMADAS EN EL SERVICIO DEL SERENAZGO MUNICIPAL;Propone regular la incorporación del personal en situación de retiro de la Policía Nacional del Perú y de las Fuerzas Armadas en el servicio de serenazgo municipal con la finalidad de mejorar y optimizar los servicios brindados por los gobiernos regionales y locales, garantizando la seguridad y el bienestar de la población dentro de un clima de paz social, de erradicación de la violencia y de utilización pacífica de las vías y espacios públicos.
LEY QUE DECLARA DE INTERÉS NACIONAL LA CONVOCATORIA A UN REFERÉNDUM PARA LA REFORMA TOTAL QUE SERÍA LA ELABORACIÓN DE UNA NUEVA CONSTITUCÍON Y/O EFECTUAR UNA REFORMA PARCIAL;Propone declarar de interés nacional la convocatoria a un referéndum para la reforma total que sería la elaboración de una nueva Constitución y/o efectuar una reforma parcial
LEY QUE DECLARA DE NECESIDAD Y URGENCIA PÚBLICA LA CREACIÓN Y EJECUCIÓN DE LOS PAQUETES INTEGRALES DE INFRAESTRUCTURA-PAININF, POR EL FONDO DE COOPERACIÓN PARA EL DESARROLLO SOCIAL, A FAVOR DE LA POBLACIÓN EN SITUACIÓN DE POBREZA, POBREZA EXTREMA Y VULNERABILIDAD;Propone declarar de necesidad y urgencia pública la creación y ejecución de los Paquetes Integrales de Infraestructura -PAININF, para que el Ministerio de Desarrollo e Inclusión Social-MIDIS, a través del Fondo de Cooperación para el Desarrollo Social-FONCODES, contribuya al cierre de brechas territoriales de infraestructura social, económica, productiva y natural, inversiones de optimización, ampliación marginal, reposición y rehabilitación, trabajando conjuntamente con la población en situación de pobreza, pobreza extrema y vulnerabilidad.
LEY QUE MODIFICA EL DELITO DE ESPECULACIÓN Y DICTA MEDIDAS PARA SU PROCESAMIENTO Y PREVENCIÓN;Propone modificar el delito de especulación previsto en el Código Penal, agravando su sanción en caso de la venta de productos farmacéuticos, dispositivo médico o equipo de bioseguridad, y dictando medidas complementarias para su procesamiento y prevención.
LEY DE LIBRE DESAFILIACIÓN DEL SISTEMA PRIVADO DE PENSIONES Y RETORNO AL SISTEMA NACIONAL DE PENSIONES O ELECCIÓN DE UNA EMPRESA DEL SISTEMA FINANCIERO PARA EL DEPÓSITO DE APORTACIONES OBLIGATORIAS CON FINES PREVISIONALES;Propone establecer la potestad de los afiliados activos y pasivos del Sistema Privado de Pensiones (SPP), de solicitar expresa y voluntariamente ante la Administradora de Fondos de Pensiones (AFP) su desafiliación, de manera presencial, por escrito, vía remoto y/o mediante los canales pertinentes, y retomar al Sistema Nacional de Pensiones (SNP), o elegir la transferencia del saldo total acumulado de su Cuenta Individual de Capitalización (CIC) para que pase a una empresa del sistema financiero supervisado por la Superintendencia de Banca y Seguros y AFP (SBS).
LEY DE JUBILACIÓN ESPECIAL DE ASEGURADOS QUE ALCANCEN MAS DE 15 AÑOS DE APORTACIONES EN EL RÉGIMEN DEL DECRETO LEY 19990, Y DEVOLUCIÓN DE APORTES PARA LOS QUE ACUMULEN MENOS DE 15 AÑOS DE APORTACIONES;Propone establecer un régimen de jubilación especial para los aportantes del Sistema Nacional de Pensiones que alcancen más de 15 años de aportaciones en el régimen del Decreto Ley 19990, que crea el Sistema Nacional de Pensiones de la Seguridad Social, y la devolución de aportes para quienes acumulen menos de 15 añlos de aportaciones al cumplir 65 años de edad o más y los intereses legales generados a la fecha.
LEY DE GARANTÍA INTEGRAL PARA LA PRIMERA LÍNEA DE TRABAJO EN EL MARCO DE LA PANDEMIA POR EL COVID-19 Y ESTABLECE RESPONSABILIDADES FUNCIONALES;Proyecto de Ley de garantía integral para la primera línea de trabajo en el marco de la pandemia por COVID-19 y establece responsbilidades funcionales
LEY QUE MODIFICA LA LEY 27933, LEY DEL SISTEMA NACIONAL DE SEGURIDAD CIUDADANA, A FIN DE INCLUIR A LAS RONDAS CAMPESINAS EN EL CONASEC;Proyecto de Ley que modifica la Ley 27933, Ley del Sistema Nacional de Seguridad Ciudadana, a fin de incluir a las Rondas Campesinas en el CONASEC
LEY QUE PRECISA LA INTANGIBILIDAD DEL MONTO RETIRADO DE FORMA VOLUNTARIA Y EXTRAORDINARIA DEL 25% DE LOS FONDOS EN EL SISTEMA PRIVADO DE PENSIONES Y SANCIONA SU INCUMPLIMIENTO;Propone precisar el carácter de intangible frente a terceros el monto retirado por los afiliados, de forma voluntaria y extraordinaria, del 25% de sus fondos, acumulados en el Sistema Privado de Pensiones (SPP), de acuerdo a lo dispuesto por la Ley 31017, Ley que establece medidas para aliviar la economía familiar y dinamizar la economía nacional en el año 2020, sancionando su incumplimiento a través de la Superintendencia de Banca, Seguros y Administradoras Privadas de Fondos de Pensiones (SBS), en concordancia con la normatividad vigente y la Constitución Política del Estado.
LEY QUE PROPONE LA VACANCIA DE AUTORIDADES LOCALES Y REGIONALES POR INCUMPLIMIENTO DE DISPOSICIONES DADAS POR EL GOBIERNO NACIONAL DURANTE ESTADO DE EMERGENCIA NACIONAL;Propone establecer la vacancia de autoridades locales y regionales por incumplimiento de los lineamientos y/o medidas de carácter temporal dadas por el Gobierno Nacional para anticipar, mitigar y dar respuestas a situaciones de necesidad de salud pública, emergencias sanitarias o desastres que ponga en riesgo la vida y/o la salud de nuestra población, sin perjuicio de las responsabilidades a que hubiere lugar, en concordancia con la normatividad vigente y la Constitución Política del Estado.
LEY QUE GARANTIZA EL DERECHO DE LOS TRABAJADORES A MANTENER VIGENTE SU SEGURO VIDA LEY AL CESE DE SU RELACIÓN LABORAL;Propone ley que garantiza el derecho del trabajador a mantener vigente su Seguro Vida Ley al término de su relación laboral.
LEY QUE GARANTIZA EL TRANSPORTE DE ALIMENTOS DE LA AGRICULTURA FAMILIAR A LA CIUDAD EN EL MARCO DE LA EMERGENCIA SANITARIA Y PRECISA EL DECRETO SUPREMO 080-2020-PCM EN FAVOR DE LA AGRICULTURA;Propone disponer de manera excepcional que el Ministerio de Transportes y Comunicaciones en coordinación con el Ministerio de Agricultura, el Ministerio del Interior, el Ministerio de Defensa, los Gobiernos Regionales y Gobiernos Locales organicen el proceso de transporte de productos de la agricultura familiar a los mercados locales, provinciales y las ciudades del país durante la Emergencia Sanitaria ante la amenaza de la pandemia del COVID-19, a fin de evitar la pérdida de cosechas, garantizar el flujo de la cadena productiva agropècuaria  y la seguridad alimentaria de la población en general.
LEY QUE DECLARA DE INTERÉS NACIONAL Y NECESIDAD PÚBLICA LA REESTRUCTURACIÓN DEL MINISTERIO DE AGRICULTURA Y RIEGO MINAGRI;Propone declarar de interés nacional y necesidad pública la reestructuración del Ministerio de Agricultura y Riego MINAGRI, a fin de que se cumplan las metas, objetivos y fines para los que  fue creado, y  fundamentalmente tenga una relación práctica y acorde a la realidad de la agricultura de las regiones de nuestro país, en beneficio de los agricultores, productores agropecuarios y la población en general vinculada directa o indirectamente al MINAGRI.
LEY QUE MODIFICA EL CÓDIGO PENAL PARA SANCIONAR CONDUCTAS ESPECULATIVAS SOBRE BIENES Y SERVICIOS DE URGENCIA PARA LA VIDA Y LA SALUD DE LAS PERSONAS;Propone sancionar diversas conductas orientadas al acaparamiento y especulación sobre bienes o servicios de necesidad urgente para la vida y la salud de las personas, por parte de productores, comerciantes o prestadores de servicios, con la finalidad de obtener un indebido provecho económico y coin el consecuente perjuicio de los consumidores.
